title,page,composer,composer_dates,source_file
Our Savior's Love,1,arr. Marvin Goldstein,b. 1950,Sacred Piano Preludes Vol. 1
As Now We Take the Sacrament,4,arr. Marvin Goldstein,b. 1950,Sacred Piano Preludes Vol. 1
God, Our Father, Hear Us Pray,7,arr. Marvin Goldstein,b. 1950,Sacred Piano Preludes Vol. 1
Jesus, Once of Humble Birth,10,arr. Marvin Goldstein,b. 1950,Sacred Piano Preludes Vol. 1
For the Beauty of the Earth,12,arr. Marvin Goldstein,b. 1950,Sacred Piano Preludes Vol. 1
Father in Heaven, We Do Believe,14,arr. Marvin Goldstein,b. 1950,Sacred Piano Preludes Vol. 1
How Great the Wisdom and the Love,16,arr. Marvin Goldstein,b. 1950,Sacred Piano Preludes Vol. 1
While of These Emblems We Partake,19,arr. Marvin Goldstein,b. 1950,Sacred Piano Preludes Vol. 1
Be Thou Humble,22,arr. Marvin Goldstein,b. 1950,Sacred Piano Preludes Vol. 1
There Is a Green Hill Far Away,24,arr. Marvin Goldstein,b. 1950,Sacred Piano Preludes Vol. 1
In Humility, Our Savior,26,arr. Marvin Goldstein,b. 1950,Sacred Piano Preludes Vol. 1
Sweet Is the Work,29,arr. Marvin Goldstein,b. 1950,Sacred Piano Preludes Vol. 1
